ID,name,descr
300,Tragedy,"A genre of drama based on human suffering and, mainly, the terrible or sorrowful events that befall a main character."
301,Gothic,"A loose literary aesthetic of fear and haunting. The name refers to Gothic architecture of the European Middle Ages, which was characteristic of the settings of early Gothic novels."
302,Bildungsroman,"A a literary genre that focuses on the psychological and moral growth of the protagonist from childhood to adulthood (coming of age), in which character change is important."
303,Romance,"A genre fiction novel that primary focuses on the relationship and romantic love between two people, typically with an emotionally satisfying and optimistic ending."
304,Narrative poetry,"A form of poetry that tells a story, often using the voices of both a narrator and characters; the entire story is usually written in metered verse."
305,Short story,"A short piece of prose fiction."
306,Poetry,"A form of literature that uses aesthetic and often rhythmic qualities of language to evoke meanings in addition to, or in place of, a prosaic ostensible meaning."